{
  "database": {
    "data_dir": "data",
    "engine": "sqlite",
    "filename": "styleseat.sqlite3",
    "legacy_unbound_migration": false,
    "migration_hook": null,
    "seed_hook": null
  },
  "deployment": {
    "profiles": {
      "cloudflare-review": {
        "mail_adapter": "redis-resend",
        "payment_adapter": "local-sandbox",
        "persistence": "ephemeral-reset"
      },
      "docker-volume": {
        "mail_adapter": "effects-gateway",
        "payment_adapter": "local-sandbox",
        "persistence": "persistent-volume"
      },
      "offline-harbor": {
        "mail_adapter": "local-outbox",
        "payment_adapter": "local-sandbox",
        "persistence": "persistent"
      }
    }
  },
  "mail": {
    "purposes": {
      "password-reset": {
        "body": "Your password reset code is ${code}.",
        "expiry": "This code expires in ${minutes} minutes.",
        "footer": "Ignore this message if you did not contact StyleSeat.",
        "lead": "A password reset was requested for StyleSeat.",
        "required_variables": [
          "code",
          "minutes"
        ],
        "secret_variables": [
          "code"
        ],
        "subject": "Reset your StyleSeat password",
        "template_id": "styleseat.password-reset.v1"
      },
      "registration": {
        "body": "Your verification code is ${code}.",
        "expiry": "This code expires in ${minutes} minutes.",
        "footer": "This code is only for StyleSeat.",
        "lead": "Finish creating your StyleSeat account.",
        "required_variables": [
          "code",
          "minutes"
        ],
        "secret_variables": [
          "code"
        ],
        "subject": "Verify your StyleSeat account",
        "template_id": "styleseat.registration.v1"
      }
    },
    "sender": {
      "address_env": "RESEND_FROM_EMAIL",
      "display_name": "StyleSeat"
    }
  },
  "payments": {
    "currency": "USD",
    "default_adapter": "local-sandbox",
    "local_sandbox": {
      "scenarios": [
        {
          "display_label": "Simulated approval",
          "id": "sandbox-approved",
          "outcome": "approved"
        },
        {
          "display_label": "Simulated decline",
          "id": "sandbox-declined",
          "outcome": "declined"
        },
        {
          "display_label": "Simulated retry",
          "id": "sandbox-retry",
          "outcome": "retryable"
        }
      ]
    },
    "stripe_test": null
  },
  "schema_version": "websitebench.site-backend-runtime.v1",
  "session": {
    "host_only": true,
    "http_only": true,
    "same_site": "Lax",
    "secure": true
  },
  "site": {
    "id": "styleseat",
    "label": "StyleSeat",
    "public_origin": "https://styleseat.offline.invalid"
  }
}
